{
  "strategy_version": "1.0.0",
  "job_id": "JAT-DEMO-001",
  "resume_id": "resume-demo-revops-v3",
  "problem_hypotheses": [
    {
      "id": "P1",
      "pain": "Pipeline and funnel reporting is not yet reliable enough for fast cross-functional decisions.",
      "confidence": "explicit",
      "job_signals": [
        {
          "signal": "Role is tasked with improving pipeline visibility, recurring reporting, metric definitions, and CRM trust.",
          "source_refs": [
            "J002"
          ],
          "source_excerpt": "improve pipeline visibility ... improve trust in CRM data"
        },
        {
          "signal": "Six-month success includes more reliable pipeline reporting and clearer ownership of revenue metrics.",
          "source_refs": [
            "J005"
          ],
          "source_excerpt": "more reliable pipeline reporting ... clearer ownership"
        }
      ],
      "business_consequences": [
        "Slower or lower-confidence revenue decisions",
        "Time spent reconciling definitions instead of acting",
        "Funnel issues may be discovered later than desired"
      ],
      "candidate_evidence": [
        {
          "evidence": "Built dbt models in BigQuery and Power BI dashboards for pipeline, funnel, and retention reporting.",
          "mapping": "Direct evidence of creating the data and reporting layer needed for trusted revenue visibility.",
          "result": "Replaced manual spreadsheet reporting and saved approximately 8 hours per week.",
          "metrics": [
            "approximately 8 hours per week"
          ],
          "fit_type": "direct",
          "source_refs": [
            "R007"
          ],
          "source_excerpt": "Built dbt models in BigQuery and Power BI dashboards"
        },
        {
          "evidence": "Standardized revenue metric definitions with Sales, Marketing, and Finance.",
          "mapping": "Direct evidence of improving cross-functional metric consistency and executive reporting.",
          "result": "Created an executive KPI review used in weekly operating meetings.",
          "metrics": [],
          "fit_type": "direct",
          "source_refs": [
            "R009"
          ],
          "source_excerpt": "standardize revenue metric definitions"
        }
      ],
      "likely_value": [
        "More trusted pipeline reporting",
        "Faster diagnosis of funnel movement",
        "Clearer metric ownership and executive alignment"
      ],
      "economic_levers": [
        {
          "lever": "manual reporting time",
          "quantification_status": "source_backed",
          "source_refs": [
            "R007"
          ]
        },
        {
          "lever": "decision speed and data trust",
          "quantification_status": "quantifiable_in_interview",
          "source_refs": [
            "J002",
            "J005"
          ]
        }
      ],
      "validation_questions": [
        "Where do teams currently disagree most on pipeline definitions or reporting?",
        "Which revenue decisions are hardest to make quickly with the reporting you have today?"
      ]
    },
    {
      "id": "P2",
      "pain": "Lead lifecycle handoffs, routing, or follow-up gaps may be suppressing conversion and creating ownership friction.",
      "confidence": "strongly_implied",
      "job_signals": [
        {
          "signal": "Role explicitly analyzes lifecycle conversion, sales handoffs, routing, and follow-up gaps.",
          "source_refs": [
            "J003"
          ],
          "source_excerpt": "lead lifecycle conversion and sales handoffs ... routing and follow-up gaps"
        },
        {
          "signal": "Success includes faster identification of funnel issues.",
          "source_refs": [
            "J005"
          ],
          "source_excerpt": "faster identification of funnel issues"
        }
      ],
      "business_consequences": [
        "Lost or delayed opportunities",
        "Inconsistent lead ownership",
        "Lower conversion through the funnel"
      ],
      "candidate_evidence": [
        {
          "evidence": "Diagnosed lifecycle and routing delays and implemented SLA monitoring and routing alerts.",
          "mapping": "Direct evidence of finding and correcting the same class of handoff problem.",
          "result": "Reduced SLA breaches from 31% to 12%.",
          "metrics": [
            "31% to 12%"
          ],
          "fit_type": "direct",
          "source_refs": [
            "R006"
          ],
          "source_excerpt": "reduced SLA breaches from 31% to 12%"
        },
        {
          "evidence": "Revenue pipeline diagnostic measured MQL conversion, first-touch SLA, routing, follow-up, and pipeline ARR.",
          "mapping": "Demonstrates a repeatable diagnostic approach to funnel and handoff risk.",
          "result": "Identified a 26% SLA breach rate and $410K in unattributed pipeline.",
          "metrics": [
            "26%",
            "$410K"
          ],
          "fit_type": "direct",
          "source_refs": [
            "R012"
          ],
          "source_excerpt": "26% SLA breach rate and $410K in unattributed pipeline"
        }
      ],
      "likely_value": [
        "Faster lead response",
        "Clearer ownership",
        "Better conversion opportunity capture"
      ],
      "economic_levers": [
        {
          "lever": "conversion and pipeline capture",
          "quantification_status": "quantifiable_in_interview",
          "source_refs": [
            "J003",
            "R006",
            "R012"
          ]
        },
        {
          "lever": "SLA breach reduction",
          "quantification_status": "source_backed",
          "source_refs": [
            "R006"
          ]
        }
      ],
      "validation_questions": [
        "Where in the lead-to-opportunity handoff do you see the most leakage or delay today?",
        "How are routing ownership and response-time expectations measured now?"
      ]
    },
    {
      "id": "P3",
      "pain": "Manual reporting and data-quality cleanup may be consuming analyst time and limiting scale.",
      "confidence": "explicit",
      "job_signals": [
        {
          "signal": "Role is expected to automate manual reporting workflows.",
          "source_refs": [
            "J003"
          ],
          "source_excerpt": "automating manual reporting workflows"
        },
        {
          "signal": "Reduced manual reporting work is a first-six-month success criterion.",
          "source_refs": [
            "J005"
          ],
          "source_excerpt": "reduced manual reporting work"
        }
      ],
      "business_consequences": [
        "Analyst capacity lost to recurring production work",
        "Higher risk of inconsistent reporting",
        "Slower iteration on higher-value analysis"
      ],
      "candidate_evidence": [
        {
          "evidence": "Replaced manual spreadsheet reporting with dbt, BigQuery, and Power BI.",
          "mapping": "Direct evidence of automating recurring reporting with a scalable data stack.",
          "result": "Saved approximately 8 hours per week.",
          "metrics": [
            "approximately 8 hours per week"
          ],
          "fit_type": "direct",
          "source_refs": [
            "R007"
          ],
          "source_excerpt": "saved approximately 8 hours per week"
        },
        {
          "evidence": "Automated CRM validation checks for missing lifecycle stages and ownership fields.",
          "mapping": "Direct evidence of reducing recurring data cleanup through preventive controls.",
          "result": "Reduced recurring reporting cleanup.",
          "metrics": [],
          "fit_type": "direct",
          "source_refs": [
            "R010"
          ],
          "source_excerpt": "automated validation checks"
        }
      ],
      "likely_value": [
        "More analyst capacity for diagnosis and recommendations",
        "More consistent reporting",
        "Less recurring CRM cleanup"
      ],
      "economic_levers": [
        {
          "lever": "analyst hours reclaimed",
          "quantification_status": "source_backed",
          "source_refs": [
            "R007"
          ]
        },
        {
          "lever": "reporting consistency and rework",
          "quantification_status": "quantifiable_in_interview",
          "source_refs": [
            "R010"
          ]
        }
      ],
      "validation_questions": [
        "Which recurring reports or data-cleanup tasks consume the most time today?",
        "What parts of the reporting workflow still require manual reconciliation before leadership can use the numbers?"
      ]
    }
  ],
  "value_thesis": {
    "one_line": "Best fit for ExampleCloud: diagnose where revenue visibility and handoffs break, build the data/reporting layer to make the issue visible, then turn the analysis into operational change.",
    "pillars": [
      "Trusted revenue visibility: dbt + BigQuery + BI plus cross-functional metric definition.",
      "Funnel diagnosis to action: lifecycle/routing analysis reduced SLA breaches from 31% to 12%.",
      "Scale through automation: replaced manual reporting and saved approximately 8 hours per week."
    ],
    "pain_specific": [
      {
        "pain_id": "P1",
        "thesis": "Can improve pipeline trust because the candidate has built reporting models, executive dashboards, and shared metric definitions across revenue teams.",
        "source_refs": [
          "R007",
          "R009",
          "J002",
          "J005"
        ]
      },
      {
        "pain_id": "P2",
        "thesis": "Can diagnose handoff leakage because the candidate has already tied lifecycle/routing analysis to a measurable SLA improvement from 31% to 12%.",
        "source_refs": [
          "R006",
          "J003"
        ]
      },
      {
        "pain_id": "P3",